timestamp,channelTitle,id,title,viewCount,likeCount,commentCount,duration
2026-03-28 19:46:11,Monitor fantasma,iDfFGMCfD-A,¿Qué pasa cuando la IA se apodera de tu cara?,1557,172,20,PT12M41S
2026-03-28 19:46:11,Monitor fantasma,49P4bNf2cXw,La IA como la sombra en la CAVERNA de Platón,7973,904,58,PT10M35S
2026-03-28 19:46:11,Monitor fantasma,PI10Q5zOH5Q,Odio el EMPODERAMIENTO... cuando usas el concepto así,6494,697,58,PT10M19S
2026-03-28 19:46:11,Monitor fantasma,u2p4FvNcBYY,La década perdida de América Latina,7129,632,69,PT11M35S
2026-03-28 19:46:11,Monitor fantasma,96yvcJspSAY,El PUNTO de DIOS explicado,7595,850,61,PT10M
2026-03-28 19:46:11,Monitor fantasma,1K9aTbPe8nc,¿Si tu profe es tan INTELIGENTE por qué es POBRE?,25180,2140,195,PT9M42S
2026-03-28 19:46:11,Monitor fantasma,2O93GjvM7G8,La generación que renunció a la calle,17372,1477,175,PT11M25S
2026-03-28 19:46:11,Monitor fantasma,6ewlC0VI-bI,"Objetividad, imparcialidad y neutralidad",12424,1361,136,PT11M33S
2026-03-28 19:46:11,Monitor fantasma,Oo6L9GjrzF4,"Tecnooptimismo, el metaverso y otras ilusiones rotas",8752,795,62,PT12M55S
2026-03-28 19:46:11,Monitor fantasma,ZBBcpbIEL-A,"Validar la guerra en Irán, la captura de Maduro y el bloqueo a Cuba",9062,1007,157,PT10M22S
2026-03-28 19:46:11,Monitor fantasma,feEsK5X_IW0,"Millennials, la generación de las experiencias sin propósito",42834,2989,410,PT11M34S
2026-03-28 19:46:11,Monitor fantasma,fYv9izCmXmA,¿Cuál es el idioma más inteligente del mundo?,46935,2371,579,PT10M33S
2026-03-28 19:46:11,Monitor fantasma,94u11lpDe8o,Esta es la metáfora de la sociedad presente,16398,1694,108,PT10M51S
2026-03-28 19:46:11,Monitor fantasma,mKxlIOqyAiI,La ESTUPIDEZ es más peligrosa que la MALDAD | Dietrich Bonhoeffer,8243,821,52,PT10M18S
2026-03-28 19:46:11,Monitor fantasma,c8k_ZNBs7sc,Más perros que hijos: La crisis que se viene,19782,1587,352,PT14M16S
2026-03-28 19:46:11,Monitor fantasma,HcKWn32vRIM,"Los Therians y Lacan: Lo imaginario, lo simbólico y lo real",51784,3517,404,PT11M31S
2026-03-28 19:46:11,Monitor fantasma,tQYuWYU3LLc,"El teletrabajo era GENIAL, pero lo arruinamos",10569,842,121,PT10M9S
2026-03-28 19:46:11,Monitor fantasma,Uxv90HRnUWI,Somos un pueblo al sur de Estados Unidos,40282,3282,718,PT12M44S
2026-03-28 19:46:11,Monitor fantasma,gj9XNHZnWAs,El caso Barbacid  y la solidaridad espontánea,10212,1141,94,PT11M57S
2026-03-28 19:46:11,Monitor fantasma,1Q3X4yROf3A,Por qué nos interesa tanto el caso Epstein y qué dice eso de nosotros,26818,1938,255,PT10M25S
2026-03-28 19:46:11,Monitor fantasma,hLiT0-pSeo4,El mito de la intuición femenina explicado,8044,811,79,PT11M3S
2026-03-28 19:46:11,Monitor fantasma,U-mU5ZQdWJA,Por qué Filosofía y Sociología superarán a las carreras “Rentables”,26392,2090,268,PT12M10S
2026-03-28 19:46:11,Monitor fantasma,QnLA4PaV-uI,Por qué Descartes creía que los animales no tenían alma,5576,506,36,PT13M2S
2026-03-28 19:46:11,Monitor fantasma,1BqLixcUofQ,De esclavo a maestro de emperadores,9771,804,44,PT11M52S
2026-03-28 19:46:11,Monitor fantasma,H4VNWy741o0,Así habla la ansiedad,7897,841,43,PT10M26S
2026-03-28 19:46:11,Monitor fantasma,CKwiIJyPV08,El libro que García Márquez NO quiso publicar ,4087,409,38,PT14M16S
2026-03-28 19:46:11,Monitor fantasma,jrcV9fyMDpM,¿Necesitas el PROMPT de otros? Ya valimos.,10208,939,55,PT10M24S
2026-03-28 19:46:11,Monitor fantasma,zvtjzHOf-aU,Cuando un solo salario NO alcanza para vivir,17896,1455,181,PT12M13S
2026-03-28 19:46:11,Monitor fantasma,kQzy3ufroHo,La fobia que nos impuso la cultura popular,4998,525,59,PT12M17S
2026-03-28 19:46:11,Monitor fantasma,Q5sq5JkufHE,El prejuicio contra India y la filosofía de la cocina,37286,3061,468,PT12M30S
2026-03-28 19:46:11,Monitor fantasma,wsbxtcmZyRg,El principio de autoconsistencia de Nóvikov,3920,444,39,PT9M34S
2026-03-28 19:46:11,Monitor fantasma,GQ-GN39LS-g,Domina tus emociones y úsalas a tu favor | Educación Emocional (Curso completo),9497,773,42,PT1H40M58S
2026-03-28 19:46:11,Monitor fantasma,nQhrqDaPQIM,La lógica estoica que rige tu pensamiento,6253,593,41,PT10M41S
2026-03-28 19:46:11,Monitor fantasma,3aM4gbOxfq4,Jesús y Nietzsche coinciden en esto,28217,2632,227,PT11M48S
2026-03-28 19:46:11,Monitor fantasma,QxU1maRUpMg,5 Pensamientos HORRIBLES para compartir en reuniones,11341,1022,66,PT10M14S
2026-03-28 19:46:11,Monitor fantasma,-yIuF0Q3J3M,Hedonismo NO ES buscar el placer,13222,1063,71,PT10M30S
2026-03-28 19:46:11,Monitor fantasma,XwX4Nd1VfBA,El feudalismo tecnológico. ¿Trabajar será un hobby?,20100,1715,247,PT12M26S
2026-03-28 19:46:11,Monitor fantasma,N1VfdRRqkiY,La HORRIBLE enciclopedia de Elon Musk,9940,888,161,PT17M29S
2026-03-28 19:46:11,Monitor fantasma,OTTnLNwqSHk,Esto es lo MÍNIMO de lógica que debes saber 🤔🧠,25689,1934,100,PT13M34S
2026-03-28 19:46:11,Monitor fantasma,_UKHNEAffd0,5 hábitos que parecen de inteligentes pero... te vuelven más tonto,74555,5260,324,PT9M59S
2026-03-28 19:46:11,Monitor fantasma,jxcv2lzAipU,"El timo del ambientalismo: tote bags, huertos y falsas soluciones",13009,1132,166,PT14M50S
2026-03-28 19:46:11,Monitor fantasma,O3y9k2X49og,"Más allá de Aristóteles: La lógica clásica, extendida y desviada",6655,640,38,PT12M24S
2026-03-28 19:46:11,Monitor fantasma,RYcY6pjTE1A,Hubo REVOLUCIÓN pero no la que él esperaba,14269,1300,381,PT13M48S
2026-03-28 19:46:11,Monitor fantasma,WH9CEybJXCQ,La fachaqueta y otras prendas ideológicas,17257,1100,134,PT9M41S
2026-03-28 19:46:11,Monitor fantasma,ckytjdr32dI,Coleccionar: el arte de dar sentido a lo inútil,45713,3138,461,PT10M21S
2026-03-28 19:46:11,Monitor fantasma,xJ7XO1nAJzA,Todo lo que tienes que saber de LÓGICA en un sólo video,42330,3060,186,PT11M7S
2026-03-28 19:46:11,Monitor fantasma,F-s4mNxdWOM,Las 3 reglas de la democracia | Una reflexión sobre la crisis de Perú,10912,1137,304,PT10M4S
2026-03-28 19:46:11,Monitor fantasma,FOabisPHbtM,La batalla silenciosa entre dos filosofías que rigen el mundo,71509,4884,406,PT15M42S
2026-03-28 19:46:11,Monitor fantasma,LaFbfC0vTJM,El opio del pueblo: Marx y la religión,11116,1048,138,PT10M27S
2026-03-28 19:46:11,Monitor fantasma,y646CBqNnfg,El modo en el que hablan los más inteligentes,182425,14068,1143,PT9M56S
2026-03-28 19:46:11,Monitor fantasma,fuYmUlIAzG8,La web está muerta (y tú ayudaste a enterrarla),23528,2256,199,PT11M1S
2026-03-28 19:46:11,Monitor fantasma,h566m1ACmX4,Los números más grandes jamás ideados,4748,580,37,PT11M56S
2026-03-28 19:46:11,Monitor fantasma,IGdymVh_G1Q,"Era la RELIGIÓN DEFINITIVA, pero llegó el Islam",42606,3267,384,PT13M9S
2026-03-28 19:46:11,Monitor fantasma,F9oEXm7QPEM,A qué se refería Cristian Castro con (no) hacer nada,30422,2417,254,PT10M25S
2026-03-28 19:46:11,Monitor fantasma,A5B5sCeggGg,7 Señales de que eres FALSO adulto,32078,3514,269,PT11M25S
2026-03-28 19:46:11,Monitor fantasma,m8KJvvtWiu4,Qué es GENTRIFICACIÓN y por qué el extranjero NO es el problema,21421,1940,269,PT9M18S
2026-03-28 19:46:11,Monitor fantasma,n40uxS-onmQ,Lo que el fracaso de Bryan Johnson debería enseñarnos sobre la vejez,79319,4551,434,PT8M2S
2026-03-28 19:46:11,Monitor fantasma,Byzb7mN1qII,¿La democracia está fallando… o simplemente la estamos viendo mal?,17224,1639,256,PT10M48S
2026-03-28 19:46:11,Monitor fantasma,SL7n7e-03LI,Ad Crumenam: Cuando los ricos son nuestra voz,9807,1045,82,PT10M5S
2026-03-28 19:46:11,Monitor fantasma,IPEGaa36Z6M,¿Por qué es IMPORTANTE aprender filosofía?,10389,1248,94,PT8M50S
2026-03-28 19:46:11,Monitor fantasma,3wuKWWWYw0Y,¿Quién es Dios? | Filosofía,11913,1184,269,PT10M21S
2026-03-28 19:46:11,Monitor fantasma,neTPaTr80zI,10 Frases que solo las personas con bajo coeficiente intelectual usan,46750,3651,626,PT8M53S
2026-03-28 19:46:11,Monitor fantasma,NTB8DN1RZ5U,La CIENCIA está en crisis y es tu culpa,17703,1650,186,PT9M32S
2026-03-28 19:46:11,Monitor fantasma,gD_Mn3L52jA,Países sin ejército ¿Cómo se defienden?,7957,786,142,PT10M23S
2026-03-28 19:46:11,Monitor fantasma,0OfxDgV6K4Q,Por qué ya NADIE camina en las ciudades,25074,2162,276,PT9M14S
2026-03-28 19:46:11,Monitor fantasma,mRagb0yTfj0,El mundo está perdiendo su color y no es broma,82559,5810,742,PT9M44S
2026-03-28 19:46:11,Monitor fantasma,4sw6-M6YPRk,Pregunta seria: ¿Por qué debo trabajar?,24641,2420,299,PT10M1S
2026-03-28 19:46:11,Monitor fantasma,r_C2m5mawsk,Cónclave: El elogio de la duda | Análisis de la película,6493,658,32,PT8M19S
2026-03-28 19:46:11,Monitor fantasma,kNCclFUhhVk,Así será EL MUNDO en 10 años según el NEOCONSERVADURISMO,23784,2025,683,PT9M48S
2026-03-28 19:46:11,Monitor fantasma,npreQulTsfQ,El Existencialismo en Minecraft: ¿Estamos Condenados a Crear?,6684,786,51,PT9M40S
2026-03-28 19:46:11,Monitor fantasma,ET1IvhKVAUo,¿Era comunista? El pensamiento del Papa Francisco,13028,1345,226,PT10M55S
2026-03-28 19:46:11,Monitor fantasma,X45usFAD6XY,Sobre la obra de Mario Vargas Llosa (Una opinión muy personal),15410,1346,127,PT9M39S
2026-03-28 19:46:11,Monitor fantasma,JQB1mBaCk6o,¿Latino o hispano? Cómo te identificas revela quién eres,18667,1772,1454,PT9M16S
2026-03-28 19:46:11,Monitor fantasma,8W1POPcJwEg,El filósofo de mentira que dijo una gran verdad,16981,1362,106,PT10M6S
2026-03-28 19:46:11,Monitor fantasma,xkkWZv7VEiY,Desglobalización: ¿El fin de la aldea global?,22195,1669,127,PT11M4S
2026-03-28 19:46:11,Monitor fantasma,Z5z24TsxfqM,Imitar el arte de Studio Ghibli ¿Robo u homenaje?,30519,2355,249,PT9M47S
2026-03-28 19:46:11,Monitor fantasma,e6opHpCazaA,¿Qué te hace único? La ontología de la diferencia de Gilles Deleuze,11433,1040,40,PT9M18S
2026-03-28 19:46:11,Monitor fantasma,xANGtbfs4uc,No. No es más fácil hacerse rico en 2025 (aunque debería),8722,901,95,PT9M51S
2026-03-28 19:46:11,Monitor fantasma,X1Q3kFZ7jvk,¿Donald Trump está loco?,32524,2644,279,PT10M40S
2026-03-28 19:46:11,Monitor fantasma,OcLzhTx19kg,10 Formas de decir NO SÉ sin decir NO SÉ,12563,1392,70,PT8M30S
2026-03-28 19:46:11,Monitor fantasma,_nMGWmJJ3kw,Lo que nadie te ha contado sobre la ECONOMÍA CIRCULAR,13723,1233,83,PT10M48S
2026-03-28 19:46:11,Monitor fantasma,XZCzgy3eGsE,Por qué NUNCA DEBERÍAS invertir en criptomonedas,31510,2925,419,PT10M40S
2026-03-28 19:46:11,Monitor fantasma,3jVR9thINzE,Cómo funciona la estafa de los pastores con 'superpoderes',71033,3250,368,PT11M43S
2026-03-28 19:46:11,Monitor fantasma,76kqH_Z1C8A,Las propinas no deberían existir (rebatiendo),10047,1059,101,PT10M29S
2026-03-28 19:46:11,Monitor fantasma,qSGan9JG-2s,5 Malos hábitos que te hacen más inteligente,19926,1999,78,PT10M24S
2026-03-28 19:46:11,Monitor fantasma,j8tsjBExtTY,Te explico el POSITIVISMO de Comte en 10 minutos,9789,881,33,PT10M25S
2026-03-28 19:46:11,Monitor fantasma,rrf9nDFvLdo,Obediencia y trabajo duro: los valores de América Latina,17693,1724,109,PT11M23S
2026-03-28 19:46:11,Monitor fantasma,_KC4rPvm5Ok,Zuckerberg y la corrección política ¿A favor o en contra?,9337,1153,146,PT9M17S
2026-03-28 19:46:11,Monitor fantasma,OiS8W_kVfGU,La Nueva Acrópolis me RETA,19708,1800,255,PT10M14S
2026-03-28 19:46:11,Monitor fantasma,HH0LX0qYm_o,5 Teorías científicas obsoletas,21991,2053,204,PT9M32S
2026-03-28 19:46:11,Monitor fantasma,7Ruhy4JQybM,Elon Musk vs Wikipedia ¿Quién tiene razón?,19595,1906,365,PT9M51S
2026-03-28 19:46:11,Monitor fantasma,TswMoaIvIE4,Por qué nunca debes aspirar a ser Batman,14990,1772,111,PT9M39S
2026-03-28 19:46:11,Monitor fantasma,HEjyHe683FI,La batalla cultural ¿El fin del progresismo?,35751,2979,336,PT10M38S
2026-03-28 19:46:11,Monitor fantasma,L360RvONXWY,Navajas filosóficas que debes conocer | Filosofía en breve,14914,1447,50,PT9M39S
2026-03-28 19:46:11,Monitor fantasma,1GlxmThKb70,La nefasta historia de los zoológicos humanos,10486,969,79,PT11M10S
2026-03-28 19:46:11,Monitor fantasma,NOZJ544BNSQ,¿Por qué la filosofía es importante?,14680,1527,92,PT12M8S
2026-03-28 19:46:11,Monitor fantasma,1xZ0XUIQp1Q,10 Términos filosóficos que siempre has usado mal,63855,5853,260,PT11M47S
2026-03-28 19:46:11,Monitor fantasma,sWmN1qTzAwM,El 99% de personas nunca tendrá personalidad,18792,2094,86,PT10M40S
2026-03-28 19:46:11,Monitor fantasma,9wcmXgLF5sY,Qué es la Posmodernidad y por qué está llegando a su fin,57622,4561,359,PT15M44S
2026-03-28 19:46:11,Monitor fantasma,2Got--odpyM,7 Paradojas que te harán reflexionar,14612,1298,45,PT10M2S
2026-03-28 19:46:11,Monitor fantasma,7AQlNkuSg2M,Qué es el tiempo de calidad y cómo impacta en tu vida,14633,1649,76,PT11M3S
2026-03-28 19:46:11,Monitor fantasma,T12VBvnbBUg,Byung-Chul Han: La sociedad de la transparencia,20591,1718,94,PT12M20S
2026-03-28 19:46:11,Monitor fantasma,g5_YJpg7ZfE,Toda mi vida he pagado de más,16959,1798,156,PT11M17S
2026-03-28 19:46:11,Monitor fantasma,FPRe31CfmVY,"Coaching, músculos y Lambos para todos",35002,3618,263,PT9M33S
2026-03-28 19:46:11,Monitor fantasma,30moX2k3V2M,"La farsa de ""la mejor versión"" | Otro engaño del Coaching",79452,7364,523,PT11M28S
2026-03-28 19:46:11,Monitor fantasma,Hj6TGoCL8oY,"No es flojera, no es depresión.",25335,2374,74,PT12M49S
2026-03-28 19:46:11,Monitor fantasma,jXV1hvQxvDU,La paradoja del conocimiento: ¿Cómo sabes que sabes?,17575,2081,168,PT11M28S
2026-03-28 19:46:11,Monitor fantasma,0v12tOVccSk,7 Frases que delatan a los débiles de mente,34337,3307,107,PT12M11S
2026-03-28 19:46:11,Monitor fantasma,JxU1VApOdUY,Schopenhauer: ¿Qué es ser un hombre de bien?,14891,1505,75,PT12M21S
2026-03-28 19:46:11,Monitor fantasma,6TY07qC1B5s,La permanencia del objeto,10138,1107,55,PT9M7S
2026-03-28 19:46:11,Monitor fantasma,HPmcOvGAzGE,Las 6 Filosofías MÁS FALSAS que son una estafa,64886,4520,515,PT11M12S
2026-03-28 19:46:11,Monitor fantasma,Mcd9gFjItmM,El estatus te está matando,31351,3248,188,PT11M23S
2026-03-28 19:46:11,Monitor fantasma,yiz-MBvvYEE,Solo los tontos escuchan esta música | Filosofía,128501,11567,2078,PT11M25S
2026-03-28 19:46:11,Monitor fantasma,y6lwus2RzXw,El Tao Te Ching (Dàodé jīng) | Reseña (resumen) del libro,14296,1302,73,PT10M46S
2026-03-28 19:46:11,Monitor fantasma,hPSYc6Uyi5c,La TV está PEOR que nunca... y es una BUENA noticia,33010,3067,287,PT11M47S
2026-03-28 19:46:11,Monitor fantasma,rbv2y5JnNQs,SUBVENCIONAR al artista no es sinónimo de desarrollo,20952,1973,281,PT10M53S
2026-03-28 19:46:11,Monitor fantasma,zt38Y9kxI4E,¿MAQUIAVELO Se arrepintió de escribir EL PRÍNCIPE?,9675,1018,34,PT10M46S
2026-03-28 19:46:11,Monitor fantasma,74Zfzx0gFxg,No hagas estas 5 COSAS y tu vida mejorará,46691,5315,266,PT10M24S
2026-03-28 19:46:11,Monitor fantasma,6bTRdZtsHg4,Apoyar a MADURO es una incompatibilidad lógica,31899,4087,876,PT9M45S
2026-03-28 19:46:11,Monitor fantasma,UQtSdX8NwHE,Te voy a SPOILEAR el futuro 🚀📴,37355,3066,254,PT11M37S
2026-03-28 19:46:11,Monitor fantasma,G6WpyiwNsvw,¿Qué es capacitismo?,14359,1678,121,PT11M31S
2026-03-28 19:46:11,Monitor fantasma,ynvunlU0laI,El imperativo categórico en La lista Schindler,12111,1299,76,PT11M3S
2026-03-28 19:46:11,Monitor fantasma,tKNRkmiT3Io,"Nietzsche: ""El abismo te devuelve la mirada""",26153,2504,97,PT10M36S
2026-03-28 19:46:11,Monitor fantasma,QmNjinvPmpU,Pesimismo aplicado: Tu OPTIMISMO apesta,21081,2145,114,PT10M33S
2026-03-28 19:46:11,Monitor fantasma,MkD35ZNYIQg,El libro que REDEFINIÓ la mediocridad humana,60494,3839,200,PT10M55S
2026-03-28 19:46:11,Monitor fantasma,UwxDJGZJL9I,El dinero 💸 NO resuelve problemas 🚫,17735,2034,236,PT10M12S
2026-03-28 19:46:11,Monitor fantasma,Xa_CrLOCEqg,¿Eres un agente del Caos? El Joker y el síndrome del Hacker,12994,1437,93,PT11M48S
2026-03-28 19:46:11,Monitor fantasma,27uv6zWR-xU,¿Qué es una IDEA? 💡🤔,11283,1120,56,PT10M35S
2026-03-28 19:46:11,Monitor fantasma,83uIr3JH3Vc,Roro y la (supuesta) polémica TradWife,34983,3366,379,PT9M31S
2026-03-28 19:46:11,Monitor fantasma,-dP-_7oFb2o,¿Eres un verdadero fan de la filosofía?,14330,1530,150,PT10M48S
2026-03-28 19:46:11,Monitor fantasma,PEBFe-LPLqQ,"Men At Work,  Emil Cioran y la lucidez vertiginosa",13268,1378,101,PT11M52S
2026-03-28 19:46:11,Monitor fantasma,62u7KFf43x0,Asimov: El culto a la ignorancia,447795,29293,2832,PT12M59S
2026-03-28 19:46:11,Monitor fantasma,ULMmlGDknAs,NO busques el SENTIDO de la vida,28309,2683,196,PT10M33S
2026-03-28 19:46:11,Monitor fantasma,XnXwZ4zseEA,La infantilización de la sociedad,83164,7147,790,PT11M36S
2026-03-28 19:46:11,Monitor fantasma,4I9JO9R4As0,7 DEBATES que marcaron la Filosofía,16072,1248,73,PT14M59S
2026-03-28 19:46:11,Monitor fantasma,Dvi-zLImEcc,¿Podría vivir toda la humanidad en una sola ciudad?,10058,965,124,PT14M29S
2026-03-28 19:46:11,Monitor fantasma,Jz-zkFTZhR4,"Más allá del meme: Chomsky, sus principales ideas",14434,1385,71,PT11M26S
2026-03-28 19:46:11,Monitor fantasma,9BBr8ckVbJA,La vida es un videojuego,10355,1098,91,PT12M42S
2026-03-28 19:46:11,Monitor fantasma,cuiMT_c5Yt8,¿Qué existe? El debate filosófico más importante,21761,1849,170,PT13M34S
2026-03-28 19:46:11,Monitor fantasma,jUoRuQ7FT_A,7 Pesimistas que no son Schopenhauer,14490,1357,124,PT11M12S
2026-03-28 19:46:11,Monitor fantasma,EKb_qnwcig0,"Los 'no me baño', el cinismo y Diógenes de Sinope",11415,1309,120,PT11M31S
2026-03-28 19:46:11,Monitor fantasma,Tnvz2hhx-b0,El libro de filosofía más devastador,34400,3054,254,PT13M25S
2026-03-28 19:46:11,Monitor fantasma,MWTI2qd3DOs,Filosofía que DOMINAS sin saber filosofía,19239,1601,102,PT13M59S
2026-03-28 19:46:11,Monitor fantasma,L0SIkNJwZ5M,El libro más corrosivo jamás escrito,32633,2295,179,PT13M55S
2026-03-28 19:46:11,Monitor fantasma,CAI9QvgfAek,7 Filosofías muy perturbadoras,41016,3414,262,PT12M46S
2026-03-28 19:46:11,Monitor fantasma,F3_ZvT1bEYk,El espíritu de la clase media,17319,1778,203,PT15M17S
2026-03-28 19:46:11,Monitor fantasma,6wvGLiDGJjc,Hegel: ¿Qué es el espíritu absoluto?,27798,1734,136,PT13M1S
2026-03-28 19:46:11,Monitor fantasma,53fcWfOur8E,Cuando la CIENCIA humilló a la FILOSOFÍA,57187,4094,474,PT11M25S
2026-03-28 19:46:11,Monitor fantasma,9Q-Pw6OeuOo,Los 7 libros de filosofía más DIFÍCILES de comprender,107792,6198,397,PT12M23S
2026-03-28 19:46:11,Monitor fantasma,cHIIKDvrQ7I,Por qué la filosofía puede ser la carrera del futuro,68986,4984,347,PT17M51S
2026-03-28 19:46:11,Monitor fantasma,GFCRKuvcTxg,Jacques Lacan: El deseo y el sentimiento de culpa,34160,2296,90,PT11M15S
2026-03-28 19:46:11,Monitor fantasma,lgmlkxG_Tfc,El síndrome del rey desnudo ¿Por qué elegimos ser estúpidos?,28205,2685,151,PT10M51S
2026-03-28 19:46:11,Monitor fantasma,ofVLVaESqH8,Esta película de Chaplin nos revela algo muy turbio,12025,1427,81,PT9M38S
2026-03-28 19:46:11,Monitor fantasma,TXSvm4QZzCo,El diagrama de la felicidad: desde Coelho hasta Nietzsche,27529,2151,158,PT15M57S
2026-03-28 19:46:11,Monitor fantasma,J-8TumPxoSQ,¡Deja de llamar tóxico a todo!,16157,1842,115,PT13M33S
2026-03-28 19:46:11,Monitor fantasma,gNdZhAGKtZA,La paradoja de Bentham y el utilitarismo filosófico,12446,1195,94,PT11M41S
2026-03-28 19:46:11,Monitor fantasma,K3vavcC_Ty0,La Sociedad del Cansancio de Byung-Chul Han,89017,7475,531,PT15M29S
2026-03-28 19:46:11,Monitor fantasma,gooctxFfKR4,Las 10 Red Flags que indican pensamiento de rebaño,36539,3648,301,PT11M56S
2026-03-28 19:46:11,Monitor fantasma,fEsqx4xHmoI,El universo según Aristóteles,11114,921,79,PT14M13S
2026-03-28 19:46:11,Monitor fantasma,WsHq3FwhF2o,¿La buena vida es cara? Respuesta a Jaime Bayly,46801,3985,326,PT13M47S
2026-03-28 19:46:11,Monitor fantasma,YECLo_OoCmU,8 Libros de filosofía FÁCILES  de leer y disfrutar,40637,3332,129,PT12M24S
2026-03-28 19:46:11,Monitor fantasma,MNa-zX8JkcU,ChatGpt vs Copilot: IAs debaten sobre el bien y el mal,12278,1083,104,PT15M51S
2026-03-28 19:46:11,Monitor fantasma,JveCh_XBKzk,"Ryan Gosling, Ken y la Masculinidad sintética",30654,3272,214,PT11M5S
2026-03-28 19:46:11,Monitor fantasma,LJgyxQmw_dg,¿Se puede MANIPULAR a cualquier persona?,17110,1692,107,PT13M27S
2026-03-28 19:46:11,Monitor fantasma,l_O1XQl-4j8,¿Por qué los protestantes son más ricos que los católicos?,27854,2486,540,PT12M8S
2026-03-28 19:46:11,Monitor fantasma,_IMe_IpJGEE,Los 7 pleitos filosóficos más famosos,23913,2006,147,PT11M29S
2026-03-28 19:46:11,Monitor fantasma,jsPXtvpl0ZY,Cuando la RELIGIÓN intentó bajarse la CIENCIA ⛪🧪,17024,1781,285,PT13M57S
2026-03-28 19:46:11,Monitor fantasma,bNf1k_OqyT0,La teoría de los tres mundos de Karl Popper,15407,1363,75,PT12M13S
2026-03-28 19:46:11,Monitor fantasma,1QFi_ZTZ0z4,Filosofía vs. Ideología: diferencias y similitudes,17775,1934,138,PT11M39S
2026-03-28 19:46:11,Monitor fantasma,2hreOCKRRuA,Qué es el humor y cuáles son sus límites,19814,1960,161,PT15M26S
2026-03-28 19:46:11,Monitor fantasma,n-4YNGCLp_g,Heidegger: Entre el existencialismo y el nazismo,8577,916,47,PT12M15S
2026-03-28 19:46:11,Monitor fantasma,n1dTLlMWIw0,Jürgen Habermas en 10 minutos  Filosofía,29606,1909,109,PT12M12S
2026-03-28 19:46:11,Monitor fantasma,t-8zZa_Y6AY,8 Hechos y verdades curiosas sobre la FILOSOFÍA,13358,1316,78,PT10M43S
2026-03-28 19:46:11,Monitor fantasma,rVCYR-dL_WA,Apología a la TIBIEZA,20129,2425,350,PT11M52S
2026-03-28 19:46:11,Monitor fantasma,ZwIy-QsPv6E,La paradoja de ser políticamente correcto,18887,2084,179,PT12M10S
2026-03-28 19:46:11,Monitor fantasma,oEHtpUbboTk,"¿Por qué Gorgias decía que ""nada existe""?",16687,1318,135,PT11M10S
2026-03-28 19:46:11,Monitor fantasma,eKHhhKRFUv4,Vives en una prisión y NO te has enterado,15482,1737,149,PT10M9S
2026-03-28 19:46:11,Monitor fantasma,TYJrSiQRPNY,Nietzsche: Cómo llegar a ser el superhombre,12757,1183,73,PT9M31S
2026-03-28 19:46:11,Monitor fantasma,M0bWO_XVQkM,Cómo enfrentarse a un tonto de manera inteligente,19313,1816,134,PT11M18S
2026-03-28 19:46:11,Monitor fantasma,yy5dCsQhJqc,La clientización de la sociedad,27185,2575,147,PT10M58S
2026-03-28 19:46:19,HugoX ChugoX,xJ8cFc5WWjo,Entrevista a ISAAC HUMALA | CICLO DE ENTREVISTAS 2026,1641,133,34,PT1H7M56S
2026-03-28 19:46:19,HugoX ChugoX,jhNKx0_s8Sw,Entrevista KATIA HUMALA TASSO | CICLO DE ENTREVISTAS 2026,2068,134,18,PT57M41S
2026-03-28 19:46:19,HugoX ChugoX,rUwSfxJCGOI,El colapso de nuestras ciudades y la solución que ningún político te cuenta,25254,1486,217,PT6M53S
2026-03-28 19:46:19,HugoX ChugoX,S_Kea8j38fQ,RESUMEN 3RA FECHA DEBATE PRESIDENCIAL 2026,59659,1981,317,PT19M45S
2026-03-28 19:46:19,HugoX ChugoX,JSdJhKjC5BA,RESUMEN 2DA FECHA DEBATE PRESIDENCIAL 2026,57459,2159,465,PT25M17S
2026-03-28 19:46:19,HugoX ChugoX,0RhPhP1cTj4,RESUMEN DEBATE PRESIDENCIAL 2026 - PARTE I,101767,4390,466,PT16M15S
2026-03-28 19:46:19,HugoX ChugoX,5REjd1h0LFM,Entrevista MESÍAS GUEVARA | CICLO DE ENTREVISTAS 2026,1871,134,26,PT1H12M52S
2026-03-28 19:46:19,HugoX ChugoX,KLWPqEPMPw8,"Entrevista a Narescka Culqui de ""Libertad Popular"" | Ciclo de entrevistas 2026",2927,142,16,PT1H16M47S
2026-03-28 19:46:19,HugoX ChugoX,gXiNM0W_NDw,LA SELVA ES CLAVE: BRASIL PIDE AL PERÚ SALIDA AL PACÍFICO,89892,4265,643,PT18M51S
2026-03-28 19:46:19,HugoX ChugoX,WapGPR-5rjs,Ciclo de entrevistas 2026: David García y Carlos Silva,1082,43,6,PT1H14M40S
2026-03-28 19:46:19,HugoX ChugoX,-q8vsX1CyEY,Entrevista MARISOL PÉREZ TELLO | CICLO DE ENTREVISTAS 2026,4362,331,86,PT57M55S
2026-03-28 19:46:19,HugoX ChugoX,7QATDNnXpv0,GAS DE CAMISEA NO SERÁ PARA SIEMPRE,108626,4074,781,PT15M37S
2026-03-28 19:46:19,HugoX ChugoX,f12h_MdTOjg,GAS DE CAMISEA: TODO LO QUE NECESITAS SABER,360284,14592,2031,PT15M26S
2026-03-28 19:46:19,HugoX ChugoX,LgmsWXyaJz8,Caso Lizeth Marzano - Adrián Villar: EXPLICACIÓN COMPLETA,123422,5353,509,PT16M10S
2026-03-28 19:46:19,HugoX ChugoX,g-_1rQkih6c,¿CÓMO CONFIAR EN LAS INMOBILIARIAS EN 2026?,9718,519,18,PT11M2S
2026-03-28 19:46:19,HugoX ChugoX,T6F8l87G3Xw,🦊La Cultura THERIAN 🐶¿Qué dice la CIENCIA al respecto?,16791,939,212,PT14M40S
2026-03-28 19:46:19,HugoX ChugoX,y2QKInW-Byc,🇵🇪NIÑO COSTERO 2026💧el ORIGEN del desastre,105552,4517,403,PT14M3S
2026-03-28 19:46:19,HugoX ChugoX,glaRQnfykeM,¿Quién es realmente José Balcázar y cómo afecta al Perú?,77789,3593,553,PT12M55S
2026-03-28 19:46:19,HugoX ChugoX,q9O1xN_qyaU,Embarazo forzado y poder político: lo que no te contaron,9302,650,154,PT11M4S
2026-03-28 19:46:19,HugoX ChugoX,jS4t7JuzL08,🇵🇪JOSÉ JERÍ: Resumen de su efímero gobierno y su caída ,88306,3479,472,PT12M
2026-03-28 19:46:19,HugoX ChugoX,HmE8ZM5ty8w,TRUJILLO ES CLAVE Y TE DIRÉ POR QUÉ ,34445,1859,316,PT5M19S
2026-03-28 19:46:19,HugoX ChugoX,Clx4BzIuewE,Breve Historia y Origen de la Diablada en Puno (Resumen),15735,757,366,PT13M17S
2026-03-28 19:46:19,HugoX ChugoX,faQdv9iZbLU,"¿Qué país es dueño de la DIABLADA, CAPORALES, SAYA Y MORENADA?",125008,6441,3511,PT26M34S
2026-03-28 19:46:19,HugoX ChugoX,neBjaqCK-Zg,🍜 CHIFAGATE: RESUMEN COMPLETO,28101,1605,172,PT11M9S
2026-03-28 19:46:19,HugoX ChugoX,lgT_jzixuWY,"¿IRÁN PODRIA CONVERTIRSE EN UNA ""COREA DEL NORTE""?",20444,1079,151,PT11M38S
2026-03-28 19:46:19,HugoX ChugoX,ekOnNnUjWmA,¿QUÉ PASA CON PETROPERÚ? ANÁLISIS DETALLADO DESDE CERO,44670,2156,581,PT12M47S
2026-03-28 19:46:19,HugoX ChugoX,u3InerqIsHI,RESUMEN JUICIO A NICOLÁS MADURO. ¿Delcy Rodríguez lo traicionó?,66633,2903,327,PT12M49S
2026-03-28 19:46:19,HugoX ChugoX,2UYbYL8_agM,EL FUTURO DE VENEZUELA. Resumen completo y cuán legitimo es la intervención de EE.UU.,153699,7094,932,PT13M17S
2026-03-28 19:46:19,HugoX ChugoX,YINDNUmxaXk,LA TRAMPA DEL “REINFO” QUE CONSUME LA AMAZONÍA 🇵🇪,31542,1632,212,PT12M27S
2026-03-28 19:46:19,HugoX ChugoX,I9nXorsytKY,El Caso JEFFREY EPSTEIN explicado desde cero,120249,4832,297,PT13M15S
2026-03-28 19:46:19,HugoX ChugoX,4hBL4rGyIDo,¿El ISLAM invadió la Cultura Occidental? ¿Representa un Peligro?,40449,2235,2832,PT16M5S
2026-03-28 19:46:19,HugoX ChugoX,dS8c7ALp9II,SUPER GRIPE H3N2: LO QUE NADIE TE CUENTA,110287,4662,778,PT13M7S
2026-03-28 19:46:19,HugoX ChugoX,XWBPhLd9yW8,¿Es el CONGRESO el verdadero PODER del PERÚ 🇵🇪?,26360,1913,339,PT11M44S
