timestamp,channelTitle,id,title,viewCount,likeCount,commentCount,duration
2026-03-28 19:46:36,Dilo Nomas,_E5GuRXljPc,💰 COMPRÉ UN ALMACÉN CON OBJETOS MUY VALIOSOS | ¿Cuánto gané? | Cachinero por un día |  Dilo Nomás,327990,7002,997,PT27M22S
2026-03-28 19:46:36,Dilo Nomas,dXGiJD0itk0,Este HOMBRE VIVE COMPLETAMENTE SOLO la PELIGR0SA SELVA del Perú | Dilo Nomás Ft. @Zoda-Rojas,37298,1275,68,PT20M27S
2026-03-28 19:46:36,Dilo Nomas,e07FfVHkV5s,Una LEYENDA maldita EVITA QUE CORTEN ESTE ÁRBOL | Dilo Nomás,55055,1977,129,PT12M1S
2026-03-28 19:46:36,Dilo Nomas,y19ddCbTMFI,🔥 Encontré ESTE CEMENTERIO ATERRADOR EN PERÚ | ALGO EXTRAÑO se OCULTABA en un ATAÚD |  Dilo Nomás,132462,3979,279,PT14M27S
2026-03-28 19:46:36,Dilo Nomas,lw6quCebD-0,Recolectamos miel de las PELIGROSAS ABEJAS SALVAJES en MEDIO DE LA SELVA | DiloNomás Ft. @Zoda-Rojas,183126,2936,158,PT26M42S
2026-03-28 19:46:36,Dilo Nomas,tsjNJg93fUE,LOS CASTAÑEROS | Algunos pierden la vida extrayendo estos frutos | DiloNomás Ft. @LimaExpresa,159291,2009,102,PT33M24S
2026-03-28 19:46:36,Dilo Nomas,NEaz6tGgBLY,🔥 Zapato NACIONAL (TRUJILLO) vs Zapato IMPORTADO | ¡Los partimos por la mitad y encontramos esto!,361571,6415,602,PT24M
2026-03-28 19:46:36,Dilo Nomas,mXnFkTXtjRc,Así eran LOS JUGUETES DE LOS NIÑOS RICOS | La Colección más ANTIGUA Y CARA de Latinoamérica | DNo+,79367,2371,94,PT23M25S
2026-03-28 19:46:36,Dilo Nomas,r72J1IevQZ8,26 AÑOS VIVIENDO SOLO FRENTE AL MAR | Construyó su casa con COSAS QUE BOTÓ EL MAR | Dilo Nomás,1197372,21800,1066,PT22M44S
2026-03-28 19:46:42,La Historia De...,t557134nuXk,LA VIDA Y OBSESIÓN DE KEIKO FUJIMORI ✍️ LA MUJER MAS PODEROSA DEL PERÚ,110353,5945,778,PT49M7S
2026-03-28 19:46:42,La Historia De...,ssywWOUD3ro,LA MUJER GENOCIDA MAS DESPIADADA DE LA HISTORIA: LA CAMARADA NORAH ✍️ ESPOSA DE ABIMAEL,139928,4915,757,PT43M58S
2026-03-28 19:46:42,La Historia De...,ypaJx5IE0Ew,¿COMO CAYÓ REALMENTE? ✍️ LA CRÓNICA COMPLETA DE LA CAPTURA DE NICOLAS MADURO,69427,2816,310,PT38M15S
2026-03-28 19:46:42,La Historia De...,Ng8L3ddODto,"CÉSAR ACUÑA y EL PODER QUE DA TENER ""PLATA COMO CANCHA” ✍️",89396,3911,448,PT46M10S
2026-03-28 19:46:42,La Historia De...,2TW0wewT5tc,10 AÑOS EN EL PODER ✍️ EL PERÚ DE VLADIMIRO MONTESINOS (1990 - 2000),178797,6861,867,PT57M48S
2026-03-28 19:46:42,La Historia De...,GPV4gqaBKSs,¿DEBERÍA SER LIBERADO EN EL 2026? ✍️ La historia de VICTOR POLAY CAMPOS y el MRTA,396590,13414,1910,PT52M41S
2026-03-28 19:46:42,La Historia De...,tGIEsUfLoe4,EL NACIONALISMO de JUAN VELASCO ALVARADO ✍️ ¿FUE UN BUEN O UN MAL PRESIDENTE?...,606689,15827,3976,PT47M32S
2026-03-28 19:46:42,La Historia De...,4ZLB_kdtCug,La historia de DONALD TRUMP: EL PODER DE UNA MARCA PERSONAL ✍️,203936,5812,525,PT39M31S
2026-03-28 19:46:42,La Historia De...,pAXEyFmPJgM,LA VIDA DE ALBERTO FUJIMORI ✍️ De no hablar español a convertirse en Presidente del Perú,847854,21293,2205,PT52M53S
2026-03-28 19:46:42,La Historia De...,ytLJu30eECk,LA GUERRA DEL PACIFICO ✍️ La historia COMPLETA,338025,10317,1264,PT48M26S
2026-03-28 19:46:42,La Historia De...,IWEfCmH7Aj8,Lo que NO contó la serie ✍️ La VERDADERA historia de ROBERTO GOMEZ BOLAÑOS - CHESPIRITO,725758,12340,616,PT46M52S
2026-03-28 19:46:42,La Historia De...,AwHSdIzsuWM,La historia de ABIMAEL GUZMAN ✍️ ¿Cómo y por qué se formó SENDERO LUMINOSO?,1378867,30767,2838,PT32M47S
2026-03-28 19:46:42,La Historia De...,UUftfwie-5Q,VLADIMIRO MONTESINOS Y SU OBSESIÓN POR EL PODER ✍️ ¿CÓMO GANÓ LA CONFIANZA DE ALBERTO FUJIMORI?,909804,23050,1845,PT39M39S
2026-03-28 19:46:42,La Historia De...,jn8jsJZ2SAY,NAYIB BUKELE Y CÓMO ACABÓ CON LAS PANDILLAS EN EL SALVADOR ✍️ EL DOCUMENTAL,2639205,74641,4595,PT34M55S
2026-03-28 19:46:42,La Historia De...,QFmgUtKb-dw,ARGENTINA vs INGLATERRA | MUNDIAL DE MÉXICO 86 ✍️ MUCHO MÁS QUE UN PARTIDO DE FUTBOL...,331820,4839,380,PT26M45S
2026-03-28 19:46:42,La Historia De...,3U96TzWNIHo,La juventud de VLADIMIRO MONTESINOS ✍️ ¿Cómo se hizo MILLONARIO antes de conocer a FUJIMORI?,842593,27197,2117,PT38M17S
2026-03-28 19:46:42,La Historia De...,zO_vCICPXLs,CIENCIANO vs BOCA JUNIORS 🏆LA SEGUNDA ESTRELLA DE CIENCIANO ✍️ EL DOCUMENTAL,493071,7681,454,PT20M8S
2026-03-28 19:46:42,La Historia De...,bpeQIiNMwdA,MARIO VARGAS LLOSA Y SU LUCHA POR SER UN ESCRITOR ✍️ ¿CÓMO GANÓ EL PREMIO NOBEL?,437247,14983,1290,PT37M26S
2026-03-28 19:46:42,La Historia De...,OhtZXTWZqRY,"HUGO ""EL CHOLO"" SOTIL ✍️ EL PERUANO MÁS TALENTOSO DE LA HISTORIA ⚽🏆 EL DOCUMENTAL",657398,5912,347,PT28M3S
2026-03-28 19:46:42,La Historia De...,EAQy_V00eHk,EL ARRIESGADO APOYO DE PERÚ a ARGENTINA 🤝 en la GUERRA DE LAS MALVINAS ✍️✈️,603348,19883,3462,PT21M49S
2026-03-28 19:46:42,La Historia De...,jsTV5_BYkVs,HABLANDO HUEVADAS ✍️ LOS PERUANOS QUE LLENARON EL MADISON SQUARE GARDEN,95672,4007,198,PT11M57S
2026-03-28 19:46:42,La Historia De...,C4g5wz2F_to,LA HISTORIA DE NICOLAS MADURO ✍️ EL COLOMBIANO CHOFER DE BUS A QUIEN CHÁVEZ LE DEJÓ TODO EL PODER,606775,16160,2310,PT27M20S
2026-03-28 19:46:42,La Historia De...,hWcJ1lSg1po,GLORIA A PERU EN LAS ALTURAS 🎙️✍️ ECUADOR (1) - (2) PERU | ELIMINATORIAS A RUSIA 2018,363887,4678,248,PT18M24S
2026-03-28 19:46:42,La Historia De...,5H4GkvhFfHc,LA OPERACION CHAVIN DE HUANTAR ✍️ ALBERTO FUJIMORI Y EL RESCATE A REHENES MAS EXITOSO DE LA HISTORIA,2678841,60393,5605,PT40M56S
2026-03-28 19:46:42,La Historia De...,vBXyzf0wnrQ,La historia de CIENCIANO CAMPEÓN COPA SUDAMERICANA 2003 🏆✍️ Unico peruano campeón internacional,2171251,22600,1628,PT30M23S
2026-03-28 19:46:42,La Historia De...,_QeOyRnP0ts,La historia de CÓMO OLIVER SONNE LLEGÓ A SER PERUANO ✍️,611108,17264,1302,PT11M50S
2026-03-28 19:46:42,La Historia De...,8R1a0GN14_s,La historia de LA MARCA PERSONAL DE REYNA A MARADONA ✍️ PERÚ (1-0) ARGENTINA. Eliminatorias a Mex 86,1868637,27678,1274,PT21M16S
2026-03-28 19:46:42,La Historia De...,Ke771A6GwYo,La historia de ALAN GARCÍA y de cómo llegó a ser presidente en 1985 con 36 años ✍️ #storytelling,1023246,22534,1326,PT21M19S
2026-03-28 19:46:42,La Historia De...,k784W8S-sCY,"La historia de ""EL BARRANQUILLAZO"" | Colombia(0) vs (1)Perú | El partido que dejó sin Mundial a COL",1141103,14841,970,PT15M3S
